unidad_academica,cargo,dedicacion,dni,desde,hasta,id_antecedente
Inversiones Alcalde y asociados S.L.,Conductor de vehículos accionados a pedal o a brazo,Investigación,58225096,2015-03-27,2020-01-03,596
Díaz y Blanes S.L.N.E,Ensamblador de equipos eléctricos,Investigación,13374933,2016-03-31,2017-08-26,183
Malena Moll Coello S.Coop.,Vendedor de comidas al mostrador,Gestión,30154058,2015-11-27,2017-02-21,795
Carretero y Maldonado S.Com.,Instalador y reparador en tecnología de la información y las comunicaciones,Docencia,21455205,2020-10-10,2021-11-03,164
Transportes Ibérica S.L.,Expendedor de gasolineras,Investigación,16342679,2015-05-31,2016-09-09,946
Barroso y asociados S.L.,Director de recursos humanos,Investigación,36448075,2013-05-12,2023-10-19,629
Puente y Olivares S.L.N.E,Conductor de automóviles,Gestión,98010691,2020-12-03,2020-12-05,85
Soluciones del Noroeste S.A.,Operador de instalaciones de tratamiento de agua,Gestión,29857434,2018-03-05,2020-02-22,12
Familia Mendizábal S.C.P,Bailarín,Docencia,27171594,2023-05-26,2024-02-23,718
Bastida y Juárez S.A.,Árbitro deportivo,Docencia,41194283,2022-08-20,2023-02-24,816
Rocamora y asociados S.L.N.E,Técnico en documentación sanitaria,Gestión,67065966,2019-12-20,2020-04-11,89
Ballester y Miguel S.A.,Catador de alimentos y bebidas,Investigación,63953035,2022-01-17,2022-06-03,760
Familia Nogués S.A.,Supervisor de secretaría,Gestión,29857434,2013-05-26,2022-08-12,12
Suministros CSZ S.Coop.,Agente de aduanas,Docencia,53681107,2017-06-15,2022-07-02,871
Hnos Torrens S.L.,Secretario jurídicos,Investigación,77196644,2016-05-22,2023-10-04,218
Instalaciones Lucas y asociados S.Coop.,Ingeniero químico,Gestión,25187562,2009-11-08,2012-02-22,620
Bartolomé y asociados S.A.T.,"Operador de incineradores, instalaciones de tratamiento de agua",Gestión,12604452,2005-05-21,2014-09-13,5
Logística Castellana S.A.,Profesional de partería,Docencia,63219550,2020-02-07,2020-11-19,140
Hermanos Giner S.Coop.,Telefonista,Docencia,35819396,2014-02-17,2023-04-06,83
Familia Dávila S.Com.,Diseñador multimedia,Docencia,53681107,2021-11-08,2023-03-26,871
Soluciones Giménez & Asociados S.L.,Cuidador de animales,Gestión,98612398,2012-07-16,2017-01-16,407
Hnos Giner S.A.,Empleado de centro de llamadas,Investigación,16114353,2012-04-11,2013-06-01,684
Alimentación Berenguer S.A.,"Operador de máquinas de preparación de fibras, hilado y devanado",Investigación,72255156,2012-07-22,2022-02-26,202
Pastora Aliaga Pacheco S.L.N.E,Bombero,Investigación,58225096,2013-04-14,2015-04-26,596
Supermercados Nadal S.A.,Profesional de partería,Gestión,48067477,2021-07-03,2022-05-29,8
Distribuciones XBR S.L.,Operador de máquinas de coser,Gestión,30154058,2020-09-11,2021-05-06,795
Manufacturas Gutierrez y asociados S.C.P,Empleado de biblioteca,Investigación,95495648,2017-04-04,2020-10-04,919
Hnos Mayol S.Coop.,Técnico forestal,Investigación,94694649,2009-07-31,2011-04-26,294
Hotel Martin S.A.T.,Cajero,Investigación,50578628,2006-06-21,2009-09-19,811
Cabrera y Zorrilla S.Com.,Cocinero,Investigación,77196644,2011-05-13,2019-02-10,218
Suministros Integrales S.A.,Operador de máquinas de tratamiento de pieles y cueros,Gestión,49925982,2017-04-02,2021-08-08,805
Distribuciones CNF S.Com.,Ingeniero electricista,Investigación,13374933,2005-10-29,2017-12-07,183
Dora Ribera Peña S.Coop.,Técnico en ciencias físicas y químicas,Investigación,47692575,2018-01-26,2022-12-12,873
Cañizares y asociados S.A.,Técnico en asistencia al usuario de tecnología de la información y las comunicaciones,Gestión,67890239,2008-06-03,2013-06-19,7
Transportes Almansa y asociados S.A.,Operario de la elaboración de productos lácteos,Docencia,56312166,2018-05-06,2021-07-10,601
Hermanos Gomez S.Com.,Mecánico y reparador de vehículos de motor,Investigación,16863756,2021-03-23,2022-08-25,365
Restauración SLSC S.Coop.,Peón de jardinería y horticultura,Investigación,99827907,2009-12-14,2018-06-12,893
Manufacturas JWS S.L.,Diseñador de bases de datos,Gestión,85117413,2009-02-17,2016-02-08,319
Finanzas ZC S.A.,Ingeniero electricista,Investigación,44374953,2021-06-22,2024-06-22,938
Hnos Soler S.A.,Operador de grúas y aparatos elevadores,Investigación,16114353,2023-01-24,2023-10-02,684
Banca Privada Enríquez y asociados S.Coop.,Cocinero de comidas rápidas,Investigación,92049177,2012-11-16,2022-08-01,358
Olmo y Giménez S.A.,Director de producción de piscicultura y pesca,Docencia,53681107,2008-05-08,2023-12-26,871
Rosa y Pineda S.Com.,Inspector medioambiental y afines,Investigación,16114353,2014-08-10,2020-10-11,684
Tecnologías Burgos S.L.,Corrector de pruebas de imprenta,Gestión,43830708,2017-09-04,2021-02-25,464
Comercial Galan S.L.L.,Recepcionista de hoteles,Investigación,39433091,2014-08-08,2015-08-25,409
Sedano & Asociados S.A.,Técnico en química industrial,Gestión,92755019,2014-01-26,2022-09-09,943
Tomás Checa Ribas S.Com.,Operador de instalaciones para la preparación de pasta para papel y papel,Docencia,35819396,2016-12-21,2018-03-26,83
Izquierdo y Alonso S.L.L.,Tenedor de libros,Investigación,39433091,2011-01-01,2011-10-09,409
Familia Almeida S.Coop.,"Gerente de centros deportivos, de esparcimiento y culturales",Gestión,60742271,2023-05-30,2024-01-28,852
Restauración Céspedes S.Coop.,"Panaderos, pasteleros y confiteros",Gestión,85117413,2005-09-16,2006-10-11,319
Toro y asociados S.Coop.,Nutricionista,Gestión,58606768,2013-03-05,2020-10-21,547
Torrents & Asociados S.L.L.,Agente inmobiliario,Docencia,21065591,2010-04-19,2011-03-24,18
Cerdán y Bustamante S.A.T.,"Pescador, cazador, tramperos y recolector de subsistencia",Docencia,21455205,2005-12-22,2016-05-17,164
Farmaceútica AS S.L.,Director de servicios de salud,Docencia,17719773,2013-07-05,2021-06-05,201
Raúl Cabrero Haro S.L.N.E,Entrenador deportivo,Investigación,77196644,2011-08-24,2012-08-17,218
Quesada y Melero S.Com.,Organizador de conferencias y eventos,Gestión,97825756,2010-05-12,2013-06-23,737
Compañía Avanzadas S.Com.,Recepcionista,Docencia,61502615,2019-05-04,2022-02-26,856
Bautista & Asociados S.A.,Cartógrafo,Gestión,90685483,2007-02-14,2007-09-04,17
Hermanos Santana S.Coop.,Ayudante de cocina,Docencia,27171594,2011-04-20,2022-11-23,718
Inmobiliaria Somoza & Asociados S.A.,Policías,Docencia,34809699,2015-08-11,2019-10-08,881
Desarrollo Mateu S.Coop.,Conductor de automóviles,Gestión,64333542,2009-01-05,2018-08-13,258
Suministros LGM S.L.,Profesional en redes de computadores,Investigación,79712341,2017-07-14,2020-04-18,863
Hermanos Amat S.Com.,"Operador de máquinas de preparación de fibras, hilado y devanado",Gestión,99799215,2022-05-20,2024-06-13,536
Nicolau & Asociados S.Com.,Electrotécnico,Docencia,34809699,2023-03-03,2023-09-23,881
Despacho Sandoval y asociados S.L.,Mecánico y reparador de vehículos de motor,Investigación,39433091,2020-07-11,2022-10-24,409
Ropero y Mulet S.L.N.E,Operador de instalaciones de vidriería y cerámica,Investigación,93039122,2009-01-16,2015-07-27,954
Fito Lopez Bernat S.A.,Oficial de préstamos y créditos,Docencia,81098805,2018-08-18,2020-04-29,331
Soluciones Blanca y asociados S.C.P,Tramper,Investigación,24070712,2015-05-10,2019-11-27,66
Familia Jove S.Com.,Director de servicios de cuidado de las personas de edad,Docencia,56312166,2013-11-13,2022-10-14,601
Dorita Mascaró Belda S.L.,Controlador de procesos,Investigación,77196644,2007-05-10,2020-11-02,218
Borrego y Palomar S.Com.,Cuidador de animales,Investigación,32239882,2011-04-29,2020-03-15,54
Desarrollo Iglesia S.Coop.,"Supervisor de mantenimiento y limpieza en oficinas, hoteles y otros establecimientos",Investigación,25768548,2009-04-29,2018-03-18,445
Transportes Madrigal S.Coop.,Periodista,Docencia,14208739,2016-05-20,2017-10-13,394
Cabañas & Asociados S.Com.,Profesional de la publicidad y la comercialización,Investigación,78739590,2006-02-20,2006-09-17,671
Banco Oliver S.Coop.,Operador de máquinas de coser,Gestión,26299601,2016-02-20,2017-08-28,96
Construcción Flores y asociados S.L.,Traductor e intérprete,Investigación,79054062,2013-03-08,2022-10-31,84
Familia Marco S.Com.,Tipógrafo,Gestión,85117413,2017-10-22,2018-07-01,319
Familia Arrieta S.Com.,Peón de obras públicas y mantenimiento,Docencia,40224905,2011-01-26,2014-12-03,332
Cepeda & Asociados S.A.,Técnico en aparatos de diagnóstico y tratamiento médico,Docencia,14157112,2020-02-07,2021-06-22,253
Banca Privada WBLU S.L.N.E,Electricista de obras,Docencia,41194283,2012-10-12,2024-01-30,816
Consultoría Cerezo S.L.N.E,Prestamista,Docencia,30854413,2012-02-11,2012-09-15,759
Hotel del Levante S.A.,Lavador de vehículos,Investigación,95495648,2023-06-17,2023-09-08,919
Rivero y Verdejo S.Coop.,Profesional de nivel medio de medicina alternativa,Investigación,96137549,2021-07-29,2021-10-01,338
Alcolea & Asociados S.A.T.,Profesional de enfermería,Gestión,85117413,2017-11-21,2021-12-09,319
Luís y Cárdenas S.A.,Cristalero,Gestión,43830708,2008-07-04,2022-05-05,464
Losa y Pons S.Com.,Historiador,Gestión,90685483,2008-04-12,2023-11-14,17
Despacho Olivera S.A.,Curador de museos,Investigación,79054062,2011-10-17,2022-11-08,84
Hermanos Rey S.A.,Agente de servicios de seguridad social,Investigación,36448075,2004-08-23,2018-03-17,629
Armida Uría Rincón S.A.,Gerente de hoteles o restaurantes,Gestión,58606768,2015-11-19,2020-05-21,547
Rueda y Arias S.L.,Perforador y sondista de pozos,Gestión,24324599,2008-05-10,2011-06-01,673
Promociones Haro S.A.,Director de servicios de cuidados infantiles,Investigación,74689524,2012-09-27,2014-09-24,451
Industrias QYHQ S.A.,Tenedor de libros,Gestión,12604452,2008-02-22,2022-04-09,5
Servicios del Sur S.Com.,Técnico en asistencia al usuario de tecnología de la información y las comunicaciones,Gestión,64763109,2019-09-26,2020-04-15,413
Lluch y Dalmau S.L.N.E,Maestro de enseñanza primaria,Investigación,62265298,2009-07-23,2016-01-21,719
Supermercados Salvà y asociados S.Com.,Peón forestales,Gestión,90685483,2015-11-24,2020-07-10,17
Soluciones ZTSP S.C.P,Director financiero,Gestión,98612398,2011-07-07,2014-06-11,407
Valenzuela y Casares S.Coop.,Vendedor ambulantes (excluyendo de comida),Gestión,12604452,2015-09-28,2017-10-05,5
Transportes Españolas S.Coop.,Director de servicios de bienestar social,Docencia,61341894,2022-11-28,2023-03-15,41
Logística Porcel y asociados S.L.N.E,Tenedor de libros,Investigación,39433091,2021-12-13,2022-12-30,409
Basilio Álvaro Palomares S.L.,Tramper,Investigación,79054062,2007-07-21,2011-02-26,84
