titulo,autores,referencia_bibliografica,año,dni
Tenetur labore magnam maiores nostrum ipsa.,Pío Matas,Magnam deleniti delectus voluptas odit quod.,2005,39450559
Pariatur esse optio voluptatum non veritatis.,Elpidio Herberto Cózar Alonso,Laudantium in quia a commodi provident magnam dignissimos.,2009,87449140
Expedita non soluta temporibus nobis voluptates repellendus.,Etelvina Botella-Vicens,Temporibus nesciunt incidunt impedit minus.,2022,80125832
Iste enim placeat.,Claudia Torrent Hoyos,Doloribus unde sed officiis consequuntur ex.,2005,96799329
Molestiae impedit fuga libero nesciunt.,Rogelio Serna-Durán,Minima dignissimos qui dolorem repellendus.,2010,62499924
Aspernatur est odio.,Reyna Valentín Español,Quis molestiae aut pariatur deleniti dolores perferendis.,2005,11007991
Labore rem fugiat.,Glauco de Bertrán,Maxime quae amet nostrum minus voluptate expedita.,2005,73999356
Dicta eius reiciendis magni sint.,Salomón Pareja Menéndez,Reiciendis maiores iure amet suscipit tempore excepturi ut.,2017,99672454
Iure dicta dolor reprehenderit dicta dolorum.,Arsenio Felipe Lluch Cañete,Delectus reprehenderit itaque distinctio nostrum.,2010,76154027
Veniam culpa optio sint.,Tomás Porras-Giménez,Veritatis neque id animi illum.,2023,76612451
Voluptatibus consequuntur cum repellat ab maiores.,Ibán Amigó,Maiores commodi facilis quas explicabo labore blanditiis.,2018,70463431
Animi sint facere deserunt asperiores.,Amor Barceló Navarro,Molestias expedita repellat odit neque ex.,2009,47789816
Amet rerum est dolorum nobis.,Balduino Sanabria Fábregas,Iure fugit numquam ut.,2007,36371337
Unde perspiciatis magni.,Lupe Bru Mendizábal,Fuga voluptas natus tempora magnam impedit dolorum.,2017,60041462
Rem ex consequuntur dolores eum.,Griselda de Velasco,Illum nemo quo quo corrupti.,2004,31031456
Aliquam optio culpa nostrum commodi.,Tamara Patiño Gutiérrez,Rerum accusamus soluta aut optio.,2005,35079418
Consectetur voluptatum id possimus amet.,Clementina Vizcaíno Carpio,Accusamus nisi fuga iusto saepe nulla qui assumenda.,2023,46524975
Deleniti ea tenetur nam.,Jose Fernandez Sedano,Quos atque temporibus ea beatae.,2005,81971860
Odit voluptatibus eos quos.,Pía Amores Manso,Nesciunt praesentium placeat quas beatae tempora error omnis.,2005,78550146
Consectetur tenetur cumque quo dolor.,Javi Cortés Valderrama,Reprehenderit nostrum error eum.,2011,20943490
In iste voluptatibus cupiditate assumenda asperiores.,Rocío Gisbert Tejero,Doloremque cupiditate eum blanditiis repudiandae.,2011,22748946
Labore assumenda vero facere.,Jose Ignacio Zurita Guerra,Inventore doloremque perspiciatis perspiciatis.,2020,50691679
Quam iure corrupti excepturi quibusdam.,Aristides Donaire Márquez,Exercitationem laudantium magnam sit iure pariatur dolorum.,2008,49743764
Optio quisquam aut magnam.,Eloy Soler Pomares,Unde possimus sit quae consequuntur inventore.,2002,91734194
Itaque cupiditate qui consequatur.,Mateo Saura Duran,Dignissimos fugiat recusandae in nesciunt magni similique.,2020,87187298
Repellendus et non excepturi earum.,Reinaldo Lumbreras-Galindo,Autem rerum est quidem.,2013,99468097
Dolorem aliquid repellat eos.,Jenny Quintana Colomer,Modi tempore blanditiis nam eum adipisci.,2017,23760438
Occaecati distinctio facere quis.,Jacobo Duilio Cabezas Fuentes,Omnis est consequatur accusantium.,2022,85631138
Accusantium quod architecto.,Ximena Prada-Landa,Soluta omnis veritatis ducimus.,2013,86171006
Commodi minus placeat impedit illo.,Maxi Berenguer,Asperiores ipsa exercitationem explicabo.,2023,69271366
Sint nesciunt dignissimos exercitationem sed.,Natalia Perera,Eaque corporis incidunt consequuntur.,2009,14832962
Ut unde eos.,Miguel Aparicio,Ratione at corporis culpa eaque nobis.,2012,71437946
Aliquam omnis doloremque libero.,Eva María Cordero-Bastida,Laborum reiciendis ea.,2014,99249760
Minus deleniti ratione modi hic.,Álvaro Ayllón-Alcalde,Iste saepe ea amet perferendis repudiandae.,2001,30677890
Perferendis rerum quis enim animi voluptates.,Alejandro Román Izaguirre,Dolorem sit neque distinctio recusandae.,2017,23396501
Mollitia voluptatum perspiciatis neque laudantium nostrum.,Amaya del Ortiz,At optio doloremque quisquam similique.,2012,77305551
Numquam velit voluptatum dicta.,León del Araujo,Sit ratione nam deleniti.,2020,96229947
Deleniti necessitatibus laboriosam aspernatur.,Elena Sarabia Abella,Eligendi vel beatae.,2014,52020406
Placeat illum asperiores in.,Carlito Bruno Santamaría Múñiz,Et vel numquam velit eius vel tenetur.,2010,86407624
Architecto perspiciatis unde.,Zaira de Angulo,Facilis exercitationem natus tempora reiciendis.,2012,18380753
Commodi perferendis error quam esse.,Feliciana Bernat-Pont,Accusantium nisi vel alias eligendi quas amet.,2015,85084907
Sequi quae occaecati.,Fulgencio Ayllón Baquero,Consequuntur quisquam odio fugiat itaque soluta.,2001,85056014
Optio numquam placeat rerum.,Reyes Araujo Abril,Fuga et quaerat vero dolorem.,2014,41696355
Ab corporis possimus repellendus.,Darío Sáenz Robles,Vitae adipisci accusamus quam odit.,2014,94533830
Consectetur adipisci maiores ipsa.,Tere Sacristán Avilés,Facere sapiente rem architecto voluptatibus dolores consequuntur.,2005,47427208
Commodi officia delectus molestiae.,Mercedes Socorro Ropero Sobrino,At deleniti adipisci doloremque tempora nobis inventore at.,2022,12483237
Pariatur possimus aperiam nostrum.,Candelaria Gomez Enríquez,Praesentium ex enim quasi commodi tempora eaque.,2023,82661640
Esse quasi vel aut.,Azahar Ocaña Blanch,Aspernatur animi est necessitatibus quo repellat.,2017,52717270
Eius aliquam error consequuntur.,Reynaldo Barrio Aliaga,Inventore saepe doloribus autem praesentium consequatur.,2014,34604237
Eveniet alias dignissimos eveniet possimus.,Ariel de Céspedes,Ad delectus voluptas soluta ratione assumenda expedita.,2010,10016679
Ullam consectetur delectus fugit.,Calixto de Alonso,Illo esse similique eaque fugiat pariatur iste.,2012,86517488
Eius doloribus molestias necessitatibus.,Ambrosio Gracia Valenzuela,Quam voluptates quo quas vero doloribus laboriosam.,2017,63615264
Reiciendis dolor illum consectetur ex molestias.,Renata Anita Guzmán Zabala,Veniam quidem neque cupiditate.,2002,24407845
Facilis praesentium minus vel.,Albert Madrigal,Quod rerum necessitatibus iusto.,2001,74877498
Deleniti suscipit hic.,Álvaro de Anguita,Molestias expedita ex ex rerum recusandae totam.,2015,79701281
Similique odio fugit ut et enim.,Paca Chacón Porras,Ab autem blanditiis sunt recusandae.,2004,57994172
Soluta quae doloribus.,Jose Ignacio Marcos Pozuelo Aguado,Molestiae temporibus ut dignissimos alias ullam quas repellendus.,2006,38335314
Accusamus fuga neque ea atque dicta.,Asdrubal Vilaplana Sandoval,Modi illo doloribus ea dolor.,2005,43876300
Voluptate eligendi neque.,Alba de Priego,Id molestiae laboriosam quis quos consequatur.,2012,24922203
Nostrum dolorem sequi quidem.,Ernesto Berenguer-Barranco,Aut molestias autem inventore ipsum.,2006,34335047
At provident harum quae numquam ipsam quisquam.,Nando de Cuesta,Ullam omnis nesciunt nihil fuga.,2005,25736119
Ex optio quidem.,Elpidio de Tur,Voluptatum mollitia harum facere consequuntur accusamus excepturi.,2011,28119821
Corporis doloribus rerum commodi mollitia.,José Antonio Guardia Angulo,Culpa qui quibusdam libero laudantium id.,2009,62772847
Voluptatibus porro reprehenderit illo vitae.,Dominga Palmer Real,Ipsam tempora a repellat debitis beatae.,2021,10422920
Sint mollitia nesciunt harum.,Luna Rebollo Escudero,Dolore repudiandae soluta ex aut delectus voluptatibus.,2003,41873300
Consequuntur eos incidunt in aliquid.,Óscar Uribe Ruano,Ipsa iure quam non esse tempora.,2008,17076916
Eum eligendi sunt recusandae deserunt laudantium.,Raúl de Canales,Molestiae dolore magni architecto repellendus doloremque architecto voluptates.,2002,23990405
Quisquam voluptatem nemo quae quod.,Nicanor Gimeno-Morán,Totam molestias deserunt ad commodi.,2018,53640451
Officiis neque dignissimos necessitatibus ipsa.,Felix Armengol,Asperiores architecto distinctio totam unde sapiente iste.,2004,22994239
Repellat minima dolorum sit.,Alicia Martí Barrera,Laboriosam saepe officia quae magnam adipisci qui.,2012,78495958
Corrupti molestiae facilis.,Curro Eutropio Herrera Mora,Sint a atque consequatur voluptatibus.,2008,64955107
Earum amet itaque labore suscipit dolorum.,Bernabé Carnero Menéndez,Dolores quo ab nemo dolorum aspernatur impedit delectus.,2018,33266975
Nam deserunt reiciendis rerum animi reiciendis.,Renata del Doménech,Provident sunt eveniet.,2012,17780614
Ut non autem exercitationem.,Victorino Palmer-Fábregas,Nam totam veritatis beatae.,2022,71652579
Molestias maiores eius sit id.,Manuela Arroyo Verdejo,Error repellat eligendi suscipit repellat.,2007,80799201
Rerum porro dolorum ipsam quam.,Vasco de Galán,Neque quisquam consectetur hic nulla eveniet molestias.,2016,73981494
Vel inventore aperiam ea explicabo.,Poncio Alcalde Noguera,Similique culpa architecto repellat nam necessitatibus ipsa.,2007,33302126
Quam deserunt quod consequuntur accusamus ratione.,Abraham Carbajo Aguilera,Harum deserunt sequi rem quam quis perferendis aspernatur.,2020,98475891
Deserunt cumque aperiam sunt.,Osvaldo Lobo Almeida,Corporis repellendus reprehenderit doloremque quibusdam non.,2009,30363062
Aut minus id.,Ismael Roselló Menéndez,Occaecati ab mollitia minus eligendi nisi quidem eligendi.,2011,82520920
Repudiandae accusantium laboriosam nesciunt.,Felicia Gallardo Asensio,Perspiciatis sequi nesciunt.,2004,79315044
Ad deserunt nemo.,Valentín Sanchez Calatayud,Ut pariatur nobis quae quo quisquam.,2013,47050126
Voluptas at expedita quibusdam mollitia.,Ernesto Recio,Voluptatem assumenda officia asperiores impedit hic illo.,2023,93652975
Nihil placeat minus expedita odio.,Fulgencio Salgado Español,Cumque velit sequi.,2016,25503930
Dolore deleniti eius est ducimus.,Aurelia Tamarit Duarte,Dolorum suscipit cupiditate commodi necessitatibus.,2008,43940350
Iste exercitationem magni veniam veniam beatae.,Abilio Sánchez Alfaro,Nisi magnam tenetur quaerat.,2003,76290751
Corrupti ab similique ratione nulla quos.,Montserrat Gálvez Folch,Animi quasi pariatur ipsam laborum tempora enim aperiam.,2022,13589355
Quasi dignissimos culpa.,Nilo Moll Mendizábal,Sit delectus id rem corrupti est facere fugit.,2008,69411430
Eius quas mollitia veniam ea.,Melisa Viñas Antón,Alias reiciendis deserunt sequi repellendus voluptatum sequi quo.,2009,32872883
Ipsum reprehenderit inventore voluptate voluptatibus nisi.,Zoraida Garay,Tempore quos minima quaerat.,2003,88601337
Autem assumenda nisi in.,Luis Miguel España-Cid,Consequatur doloribus quasi ducimus consequatur molestias facere temporibus.,2017,14318284
Optio consequuntur dolore.,Reina Álvarez Comas,Voluptatem sed fugit quis libero excepturi reiciendis ad.,2010,32879818
Odio id esse cum aperiam praesentium.,Anastasia Gascón,Deleniti at iste hic accusantium in dicta.,2017,62354595
Dolorem quibusdam esse autem eligendi blanditiis.,Juan Carlos del Castejón,Soluta deserunt totam ut ad voluptates.,2006,84869259
Eaque deleniti magni eos.,Ambrosio Verdú Cerezo,Perferendis tenetur cumque mollitia eligendi maiores.,2019,33751741
Inventore repellendus fugiat et eum.,Victor del Pou,Architecto totam natus doloribus.,2006,67286954
Accusamus quas perferendis quidem sunt vitae.,Amado Jacinto Mora Royo,Accusamus dolor ducimus provident corrupti incidunt.,2015,86454667
Laudantium cupiditate neque amet optio.,Víctor de Pintor,Perspiciatis at voluptatum autem reprehenderit.,2016,64183501
Officia esse alias a ullam.,José Mari Sanz Castell,Quibusdam error voluptas dolor eligendi dolorem.,2020,47762523
Praesentium dolorum maiores sunt.,Edgardo Muñoz Caparrós,Praesentium consequuntur dolor a ea corrupti id.,2013,78060667
